id,custom_id,error,response.status_code,response.request_id,response.body.id,response.body.object,response.body.created,response.body.model,response.body.choices,response.body.usage.prompt_tokens,response.body.usage.completion_tokens,response.body.usage.total_tokens,response.body.usage.completion_tokens_details.reasoning_tokens,response.body.system_fingerprint
batch_req_d2co0bbHkUT3dFFZak8JwCKm,task-0,,200,06bc4cd961830cd69dbdf8beb746b208,chatcmpl-A7pCUrAxcNPXXqiauY3AuJ2rEA3qh,chat.completion,1726428474,gpt-4o-mini-2024-07-18,"[{'index': 0, 'message': {'role': 'assistant', 'content': '{\n    ""nodes"": [\n        {\n            ""id"": 1,\n            ""label"": ""luis hermosilla"",\n            ""summary"": ""Luis Hermosilla is a lawyer implicated in multiple corruption cases, currently in preventive detention.""\n        },\n        {\n            ""id"": 2,\n            ""label"": ""ángela vivanco"",\n            ""summary"": ""Ángela Vivanco is a Supreme Court minister under investigation for alleged influence peddling and corruption linked to Luis Hermosilla.""\n        },\n        {\n            ""id"": 3,\n            ""label"": ""felipe ward"",\n            ""summary"": ""Felipe Ward is a former Minister of Housing linked to corruption allegations involving expedited permits for a real estate project.""\n        },\n        {\n            ""id"": 4,\n            ""label"": ""andrés chadwick"",\n            ""summary"": ""Andrés Chadwick is a former Minister of the Interior implicated in the corruption scandal through his connections with Luis Hermosilla.""\n        },\n        {\n            ""id"": 5,\n            ""label"": ""daniel sauer"",\n            ""summary"": ""Daniel Sauer is a businessman involved in the Factop scandal, linked to bribery and corruption through his association with Luis Hermosilla.""\n        },\n        {\n            ""id"": 6,\n            ""label"": ""ariel sauer"",\n            ""summary"": ""Ariel Sauer is a businessman and brother of Daniel Sauer, implicated in the same corruption case involving Luis Hermosilla.""\n        },\n        {\n            ""id"": 7,\n            ""label"": ""raul letelier"",\n            ""summary"": ""Raúl Letelier is the president of the Council of Defense of the State, which is pursuing legal action against Luis Hermosilla.""\n        },\n        {\n            ""id"": 8,\n            ""label"": ""gustavo benavente"",\n            ""summary"": ""Gustavo Benavente is a UDI deputy defending Andrés Chadwick amid corruption allegations related to Luis Hermosilla.""\n        },\n        {\n            ""id"": 9,\n            ""label"": ""jorge alessandri"",\n            ""summary"": ""Jorge Alessandri is a UDI deputy who has defended Andrés Chadwick in the context of the corruption scandal involving Luis Hermosilla.""\n        },\n        {\n            ""id"": 10,\n            ""label"": ""mario carrera"",\n            ""summary"": ""Mario Carrera is a regional prosecutor involved in the investigations related to the corruption cases surrounding Luis Hermosilla.""\n        },\n        {\n            ""id"": 11,\n            ""label"": ""carmen gloria wittwer"",\n            ""summary"": ""Carmen Gloria Wittwer is a regional prosecutor overseeing the investigation into Ángela Vivanco and her connections to Luis Hermosilla.""\n        },\n        {\n            ""id"": 12,\n            ""label"": ""lorena parra"",\n            ""summary"": ""Lorena Parra is a prosecutor involved in the case against Luis Hermosilla and others implicated in corruption.""\n        },\n        {\n            ""id"": 13,\n            ""label"": ""sergio muñoz"",\n            ""summary"": ""Sergio Muñoz is a former director of the PDI implicated in the corruption scandal for leaking sensitive information to Luis Hermosilla.""\n        },\n        {\n            ""id"": 14,\n            ""label"": ""leonarda villalobos"",\n            ""summary"": ""Leonarda Villalobos is a lawyer involved in the corruption case, having recorded conversations with Luis Hermosilla.""\n        },\n        {\n            ""id"": 15,\n            ""label"": ""raul letelier"",\n            ""summary"": ""Raúl Letelier is the president of the Council of Defense of the State, which is pursuing legal action against Luis Hermosilla.""\n        }\n    ],\n    ""edges"": [\n        {\n            ""from"": 1,\n            ""to"": 2,\n            ""label"": ""associate"",\n            ""summary"": ""Luis Hermosilla and Ángela Vivanco are associated through their involvement in the corruption case.""\n        },\n        {\n            ""from"": 1,\n            ""to"": 3,\n            ""label"": ""associate"",\n            ""summary"": ""Luis Hermosilla and Felipe Ward are associated through allegations of corruption related to expedited permits.""\n        },\n        {\n            ""from"": 1,\n            ""to"": 4,\n            ""label"": ""associate"",\n            ""summary"": ""Luis Hermosilla and Andrés Chadwick are associated through their connections in the corruption scandal.""\n        },\n        {\n            ""from"": 1,\n            ""to"": 5,\n            ""label"": ""partner"",\n            ""summary"": ""Luis Hermosilla and Daniel Sauer are partners in the context of the Factop corruption case.""\n        },\n        {\n            ""from"": 1,\n            ""to"": 6,\n            ""label"": ""partner"",\n            ""summary"": ""Luis Hermosilla and Ariel Sauer are partners involved in the corruption case surrounding Factop.""\n        },\n        {\n            ""from"": 1,\n            ""to"": 7,\n            ""label"": ""investigator"",\n            ""summary"": ""Raúl Letelier is investigating Luis Hermosilla as part of the Council of Defense of the State.""\n        },\n        {\n            ""from"": 1,\n            ""to"": 8,\n            ""label"": ""defendant"",\n            ""summary"": ""Luis Hermosilla and Gustavo Benavente are connected through the defense of Andrés Chadwick in the corruption case.""\n        },\n        {\n            ""from"": 1,\n            ""to"": 9,\n            ""label"": ""defendant"",\n            ""summary"": ""Luis Hermosilla and Jorge Alessandri are connected through the defense of Andrés Chadwick amid corruption allegations.""\n        },\n        {\n            ""from"": 1,\n            ""to"": 10,\n            ""label"": ""investigator"",\n            ""summary"": ""Mario Carrera is investigating Luis Hermosilla as part of the corruption case.""\n        },\n        {\n            ""from"": 1,\n            ""to"": 11,\n            ""label"": ""investigator"",\n            ""summary"": ""Carmen Gloria Wittwer is investigating Luis Hermosilla and Ángela Vivanco in the corruption case.""\n        },\n        {\n            ""from"": 1,\n            ""to"": 12,\n            ""label"": ""investigator"",\n            ""summary"": ""Lorena Parra is involved in the investigation of Luis Hermosilla and the corruption case.""\n        },\n        {\n            ""from"": 1,\n            ""to"": 13,\n            ""label"": ""informant"",\n            ""summary"": ""Sergio Muñoz provided information to Luis Hermosilla regarding sensitive cases.""\n        },\n        {\n            ""from"": 1,\n            ""to"": 14,\n            ""label"": ""collaborator"",\n            ""summary"": ""Luis Hermosilla and Leonarda Villalobos collaborated in the context of the corruption case.""\n        },\n        {\n            ""from"": 2,\n            ""to"": 11,\n            ""label"": ""defendant"",\n            ""summary"": ""Ángela Vivanco and Carmen Gloria Wittwer are connected through the investigation into Vivanco\'s actions.""\n        },\n        {\n            ""from"": 3,\n            ""to"": 4,\n            ""label"": ""associate"",\n            ""summary"": ""Felipe Ward and Andrés Chadwick are associated through their political roles and the corruption case.""\n        }\n    ]\n}', 'refusal': None}, 'logprobs': None, 'finish_reason': 'stop'}]",42601,1535,44136,0,fp_483d39d857
batch_req_7cntG3ejZxssC3LnotmK0Q7Y,task-1,,200,b081652e146cf33abc0cddcda1d14182,chatcmpl-A7pCVzOyx3eJXpGoA0YuJRHQJAQm0,chat.completion,1726428475,gpt-4o-mini-2024-07-18,"[{'index': 0, 'message': {'role': 'assistant', 'content': '{\n    ""nodes"": [\n        {\n            ""id"": 1,\n            ""label"": ""luis hermosilla"",\n            ""summary"": ""Luis Hermosilla is a lawyer currently in preventive detention for involvement in corruption cases, including tax crimes and bribery.""\n        },\n        {\n            ""id"": 2,\n            ""label"": ""maría leonarda villalobos"",\n            ""summary"": ""María Leonarda Villalobos is a lawyer in preventive detention alongside Luis Hermosilla, implicated in corruption and financial crimes.""\n        },\n        {\n            ""id"": 3,\n            ""label"": ""juan pablo hermosilla"",\n            ""summary"": ""Juan Pablo Hermosilla is the brother of Luis Hermosilla and serves as his defense attorney, actively participating in the legal strategy.""\n        },\n        {\n            ""id"": 4,\n            ""label"": ""rodrigo topelberg"",\n            ""summary"": ""Rodrigo Topelberg is an engineer who leaked the audio that led to the arrest of Luis Hermosilla and others, claiming to have been manipulated by them.""\n        },\n        {\n            ""id"": 5,\n            ""label"": ""katherine martorell"",\n            ""summary"": ""Katherine Martorell is a former undersecretary under investigation for corruption related to a police equipment tender, with ties to Luis Hermosilla.""\n        },\n        {\n            ""id"": 6,\n            ""label"": ""andrés chadwick"",\n            ""summary"": ""Andrés Chadwick is a former Minister of the Interior, closely associated with Luis Hermosilla, and implicated in corruption allegations.""\n        },\n        {\n            ""id"": 7,\n            ""label"": ""felipe ward"",\n            ""summary"": ""Felipe Ward is a former Minister of Housing under investigation for allegedly expediting permits for Grupo Patio, linked to Luis Hermosilla.""\n        },\n        {\n            ""id"": 8,\n            ""label"": ""ángela vivanco"",\n            ""summary"": ""Ángela Vivanco is a Supreme Court minister whose communications with Luis Hermosilla suggest possible influence and corruption in judicial appointments.""\n        },\n        {\n            ""id"": 9,\n            ""label"": ""daniel sauer"",\n            ""summary"": ""Daniel Sauer is a businessman involved in the Factop scandal, linked to Luis Hermosilla and implicated in financial crimes.""\n        },\n        {\n            ""id"": 10,\n            ""label"": ""gabriel boric"",\n            ""summary"": ""Gabriel Boric is the President of Chile, mentioned in the context of the political fallout from the Hermosilla case.""\n        },\n        {\n            ""id"": 11,\n            ""label"": ""carolina tohá"",\n            ""summary"": ""Carolina Tohá is the Minister of the Interior, mentioned in relation to the political implications of the Hermosilla case.""\n        },\n        {\n            ""id"": 12,\n            ""label"": ""luis cordero"",\n            ""summary"": ""Luis Cordero is the Minister of Justice, involved in discussions about the implications of the Hermosilla case on the judicial system.""\n        },\n        {\n            ""id"": 13,\n            ""label"": ""mariana leyton"",\n            ""summary"": ""Mariana Leyton is a judge involved in the case against Hermosilla and Villalobos, overseeing their preventive detention.""\n        },\n        {\n            ""id"": 14,\n            ""label"": ""miguel vázquez"",\n            ""summary"": ""Miguel Vázquez is a judge in the Appeals Court who confirmed the preventive detention of Hermosilla and Villalobos.""\n        },\n        {\n            ""id"": 15,\n            ""label"": ""lidia poza"",\n            ""summary"": ""Lidia Poza is a judge in the Appeals Court involved in the decision to maintain the preventive detention of Hermosilla and Villalobos.""\n        },\n        {\n            ""id"": 16,\n            ""label"": ""luis hernández"",\n            ""summary"": ""Luis Hernández is a lawyer in the Appeals Court who participated in the decision regarding the preventive detention of Hermosilla and Villalobos.""\n        },\n        {\n            ""id"": 17,\n            ""label"": ""tonka tomicic"",\n            ""summary"": ""Tonka Tomicic is a television presenter who is set to testify regarding her connections to the Hermosilla case.""\n        },\n        {\n            ""id"": 18,\n            ""label"": ""sergio jara"",\n            ""summary"": ""Sergio Jara is a journalist who reported on the Hermosilla case and the implications of the leaked chats.""\n        },\n        {\n            ""id"": 19,\n            ""label"": ""pablo norambuena"",\n            ""summary"": ""Pablo Norambuena is a former prosecutor who commented on the severity of the charges against Hermosilla and Villalobos.""\n        },\n        {\n            ""id"": 20,\n            ""label"": ""daniel manouchehri"",\n            ""summary"": ""Daniel Manouchehri is a socialist deputy and querellante in the Hermosilla case, advocating for accountability in corruption.""\n        },\n        {\n            ""id"": 21,\n            ""label"": ""daniella cicardini"",\n            ""summary"": ""Daniella Cicardini is a socialist deputy involved in pushing for constitutional accusations against judges linked to the Hermosilla case.""\n        },\n        {\n            ""id"": 22,\n            ""label"": ""ricardo blanco"",\n            ""summary"": ""Ricardo Blanco is the president of the Supreme Court, expressing concern over the implications of the Hermosilla case.""\n        },\n        {\n            ""id"": 23,\n            ""label"": ""manuel josé errázuriz"",\n            ""summary"": ""Manuel José Errázuriz is a former seremi of Housing who alleged pressure from Felipe Ward to expedite permits for Grupo Patio.""\n        },\n        {\n            ""id"": 24,\n            ""label"": ""álvaro jalaff"",\n            ""summary"": ""Álvaro Jalaff is a businessman linked to Grupo Patio and involved in financial dealings with Luis Hermosilla.""\n        }\n    ],\n    ""edges"": [\n        {\n            ""from"": 1,\n            ""to"": 2,\n            ""label"": ""defendant"",\n            ""summary"": ""Luis Hermosilla and María Leonarda Villalobos are co-defendants in the same corruption case.""\n        },\n        {\n            ""from"": 1,\n            ""to"": 3,\n            ""label"": ""associate"",\n            ""summary"": ""Luis Hermosilla is represented by his brother Juan Pablo Hermosilla in legal matters.""\n        },\n        {\n            ""from"": 1,\n            ""to"": 4,\n            ""label"": ""intermediary"",\n            ""summary"": ""Rodrigo Topelberg leaked the audio that implicated Luis Hermosilla in corruption.""\n        },\n        {\n            ""from"": 1,\n            ""to"": 5,\n            ""label"": ""associate"",\n            ""summary"": ""Katherine Martorell was represented by Luis Hermosilla in a previous legal matter.""\n        },\n        {\n            ""from"": 1,\n            ""to"": 6,\n            ""label"": ""associate"",\n            ""summary"": ""Luis Hermosilla has a close relationship with former Minister Andrés Chadwick.""\n        },\n        {\n            ""from"": 1,\n            ""to"": 7,\n            ""label"": ""associate"",\n            ""summary"": ""Luis Hermosilla is linked to Felipe Ward through allegations of expedited permits.""\n        },\n        {\n            ""from"": 1,\n            ""to"": 8,\n            ""label"": ""associate"",\n            ""summary"": ""Luis Hermosilla has communicated with Ángela Vivanco regarding judicial appointments.""\n        },\n        {\n            ""from"": 1,\n            ""to"": 9,\n            ""label"": ""associate"",\n            ""summary"": ""Daniel Sauer is involved in the same financial crimes as Luis Hermosilla.""\n        },\n        {\n            ""from"": 1,\n            ""to"": 10,\n            ""label"": ""observer"",\n            ""summary"": ""Gabriel Boric is aware of the implications of the Hermosilla case on the political landscape.""\n        },\n        {\n            ""from"": 1,\n            ""to"": 11,\n            ""label"": ""observer"",\n            ""summary"": ""Carolina Tohá is aware of the political fallout from the Hermosilla case.""\n        },\n        {\n            ""from"": 1,\n            ""to"": 12,\n            ""label"": ""observer"",\n            ""summary"": ""Luis Cordero is involved in discussions about the implications of the Hermosilla case.""\n        },\n        {\n            ""from"": 1,\n            ""to"": 13,\n            ""label"": ""observer"",\n            ""summary"": ""Mariana Leyton is the judge overseeing the case against Luis Hermosilla.""\n        },\n        {\n            ""from"": 1,\n            ""to"": 14,\n            ""label"": ""observer"",\n            ""summary"": ""Miguel Vázquez is a judge involved in the decision regarding Hermosilla\'s preventive detention.""\n        },\n        {\n            ""from"": 1,\n            ""to"": 15,\n            ""label"": ""observer"",\n            ""summary"": ""Lidia Poza is a judge involved in the decision regarding Hermosilla\'s preventive detention.""\n        },\n        {\n            ""from"": 1,\n            ""to"": 16,\n            ""label"": ""observer"",\n            ""summary"": ""Luis Hernández is a judge involved in the decision regarding Hermosilla\'s preventive detention.""\n        },\n        {\n            ""from"": 1,\n            ""to"": 17,\n            ""label"": ""observer"",\n            ""summary"": ""Tonka Tomicic is expected to testify regarding her connections to Luis Hermosilla.""\n        },\n        {\n            ""from"": 1,\n            ""to"": 18,\n            ""label"": ""observer"",\n            ""summary"": ""Sergio Jara is a journalist reporting on the Hermosilla case.""\n        },\n        {\n            ""from"": 1,\n            ""to"": 19,\n            ""label"": ""observer"",\n            ""summary"": ""Pablo Norambuena has commented on the severity of the charges against Hermosilla.""\n        },\n        {\n            ""from"": 1,\n            ""to"": 20,\n            ""label"": ""whistleblower"",\n            ""summary"": ""Daniel Manouchehri is a querellante in the Hermosilla case, advocating for accountability.""\n        },\n        {\n            ""from"": 1,\n            ""to"": 21,\n            ""label"": ""whistleblower"",\n            ""summary"": ""Daniella Cicardini is a querellante in the Hermosilla case, advocating for accountability.""\n        },\n        {\n            ""from"": 1,\n            ""to"": 22,\n            ""label"": ""observer"",\n            ""summary"": ""Ricardo Blanco is the president of the Supreme Court, expressing concern over the implications of the Hermosilla case.""\n        },\n        {\n            ""from"": 1,\n            ""to"": 23,\n            ""label"": ""informant"",\n            ""summary"": ""Manuel José Errázuriz has alleged pressure from Felipe Ward regarding permits for Grupo Patio.""\n        },\n        {\n            ""from"": 1,\n            ""to"": 24,\n            ""label"": ""associate"",\n            ""summary"": ""Álvaro Jalaff is a businessman linked to Grupo Patio and involved in financial dealings with Luis Hermosilla.""\n        }\n    ]\n}', 'refusal': None}, 'logprobs': None, 'finish_reason': 'stop'}]",43027,2409,45436,0,fp_483d39d857
