id,custom_id,error,response.status_code,response.request_id,response.body.id,response.body.object,response.body.created,response.body.model,response.body.choices,response.body.usage.prompt_tokens,response.body.usage.completion_tokens,response.body.usage.total_tokens,response.body.usage.completion_tokens_details.reasoning_tokens,response.body.system_fingerprint
batch_req_M5ozdtbIMHIOgYvmGNoS2FDQ,task-15,,200,8f7ec6c8cf49c25be339f2e2cd9958fb,chatcmpl-A7pCWblcJuAai7Q7ARvSydaP5bS2N,chat.completion,1726428476,gpt-4o-mini-2024-07-18,"[{'index': 0, 'message': {'role': 'assistant', 'content': '{\n    ""nodes"": [\n        {\n            ""id"": 1,\n            ""label"": ""luis hermosilla"",\n            ""summary"": ""Luis Hermosilla is a lawyer implicated in multiple corruption cases, including bribery, tax crimes, and money laundering.""\n        },\n        {\n            ""id"": 2,\n            ""label"": ""ángel valencia"",\n            ""summary"": ""Ángel Valencia is the National Prosecutor of Chile who had prior professional interactions with Luis Hermosilla before assuming his current role.""\n        },\n        {\n            ""id"": 3,\n            ""label"": ""lorena parra"",\n            ""summary"": ""Lorena Parra is a prosecutor involved in the investigation of Luis Hermosilla and has been mentioned in chats with him.""\n        },\n        {\n            ""id"": 4,\n            ""label"": ""juan pablo hermosilla"",\n            ""summary"": ""Juan Pablo Hermosilla is the brother and defense attorney of Luis Hermosilla, actively defending him in the corruption case.""\n        },\n        {\n            ""id"": 5,\n            ""label"": ""sebastián piñera"",\n            ""summary"": ""Sebastián Piñera is a former president of Chile who was previously represented by Luis Hermosilla and is indirectly linked to the corruption case.""\n        },\n        {\n            ""id"": 6,\n            ""label"": ""andrés chadwick"",\n            ""summary"": ""Andrés Chadwick is a former Minister of the Interior whose connections to Luis Hermosilla are under investigation in relation to the corruption case.""\n        },\n        {\n            ""id"": 7,\n            ""label"": ""gonzalo blumel"",\n            ""summary"": ""Gonzalo Blumel is a former Minister of the Interior who mentioned Luis Hermosilla in his book, indicating their professional connections.""\n        },\n        {\n            ""id"": 8,\n            ""label"": ""maría leonarda villalobos"",\n            ""summary"": ""María Leonarda Villalobos is a co-defendant with Luis Hermosilla in the corruption case, facing similar charges.""\n        },\n        {\n            ""id"": 9,\n            ""label"": ""manuel guerra"",\n            ""summary"": ""Manuel Guerra is a former prosecutor linked to Luis Hermosilla through chats discussing various legal cases, including the Penta case.""\n        },\n        {\n            ""id"": 10,\n            ""label"": ""jean pierre matus"",\n            ""summary"": ""Jean Pierre Matus is a Supreme Court minister who had prior communications with Luis Hermosilla, raising concerns about judicial integrity.""\n        },\n        {\n            ""id"": 11,\n            ""label"": ""mario desbordes"",\n            ""summary"": ""Mario Desbordes is a former Minister of Defense who has publicly commented on the implications of the Hermosilla case for the political sector.""\n        },\n        {\n            ""id"": 12,\n            ""label"": ""camila tohá"",\n            ""summary"": ""Camila Tohá is the Minister of the Interior who has defended the government\'s stance on the Hermosilla case amidst accusations of political interference.""\n        },\n        {\n            ""id"": 13,\n            ""label"": ""luis cordero"",\n            ""summary"": ""Luis Cordero is the Minister of Justice who has responded to accusations regarding the government\'s involvement in the Hermosilla case.""\n        },\n        {\n            ""id"": 14,\n            ""label"": ""constanza martínez"",\n            ""summary"": ""Constanza Martínez is the president of the Frente Amplio who has commented on the implications of the Hermosilla case for public perception of justice.""\n        },\n        {\n            ""id"": 15,\n            ""label"": ""raul soto"",\n            ""summary"": ""Raúl Soto is a deputy who has expressed the need for transparency in the Hermosilla case and the importance of accountability.""\n        },\n        {\n            ""id"": 16,\n            ""label"": ""emilia ríos"",\n            ""summary"": ""Emilia Ríos is the mayor of Ñuñoa who has criticized Sebastián Sichel\'s connections to Luis Hermosilla in the context of the upcoming elections.""\n        },\n        {\n            ""id"": 17,\n            ""label"": ""sebastián sichel"",\n            ""summary"": ""Sebastián Sichel is a candidate for mayor of Ñuñoa who has been mentioned in connection with Luis Hermosilla during the corruption investigation.""\n        }\n    ],\n    ""edges"": [\n        {\n            ""from"": 1,\n            ""to"": 2,\n            ""label"": ""acquaintance"",\n            ""summary"": ""Luis Hermosilla and Ángel Valencia have had professional interactions prior to Valencia\'s role as National Prosecutor.""\n        },\n        {\n            ""from"": 1,\n            ""to"": 3,\n            ""label"": ""acquaintance"",\n            ""summary"": ""Luis Hermosilla and Lorena Parra are connected through their involvement in the corruption investigation.""\n        },\n        {\n            ""from"": 1,\n            ""to"": 4,\n            ""label"": ""associate"",\n            ""summary"": ""Juan Pablo Hermosilla is both the brother and defense attorney of Luis Hermosilla, actively involved in his legal defense.""\n        },\n        {\n            ""from"": 1,\n            ""to"": 5,\n            ""label"": ""associate"",\n            ""summary"": ""Luis Hermosilla previously represented Sebastián Piñera, establishing a professional connection.""\n        },\n        {\n            ""from"": 1,\n            ""to"": 6,\n            ""label"": ""associate"",\n            ""summary"": ""Andrés Chadwick\'s connections to Luis Hermosilla are under scrutiny in the corruption investigation.""\n        },\n        {\n            ""from"": 1,\n            ""to"": 7,\n            ""label"": ""associate"",\n            ""summary"": ""Gonzalo Blumel mentioned Luis Hermosilla in his book, indicating their professional relationship.""\n        },\n        {\n            ""from"": 1,\n            ""to"": 8,\n            ""label"": ""defendant"",\n            ""summary"": ""Luis Hermosilla and María Leonarda Villalobos are co-defendants in the same corruption case.""\n        },\n        {\n            ""from"": 1,\n            ""to"": 9,\n            ""label"": ""intermediary"",\n            ""summary"": ""Luis Hermosilla and Manuel Guerra exchanged information regarding various legal cases, including the Penta case.""\n        },\n        {\n            ""from"": 1,\n            ""to"": 10,\n            ""label"": ""intermediary"",\n            ""summary"": ""Luis Hermosilla had prior communications with Jean Pierre Matus, raising concerns about judicial integrity.""\n        },\n        {\n            ""from"": 1,\n            ""to"": 11,\n            ""label"": ""other"",\n            ""summary"": ""Mario Desbordes has commented on the implications of the Hermosilla case for the political sector.""\n        },\n        {\n            ""from"": 1,\n            ""to"": 12,\n            ""label"": ""other"",\n            ""summary"": ""Camila Tohá has defended the government\'s stance on the Hermosilla case amidst accusations of political interference.""\n        },\n        {\n            ""from"": 1,\n            ""to"": 13,\n            ""label"": ""other"",\n            ""summary"": ""Luis Cordero has responded to accusations regarding the government\'s involvement in the Hermosilla case.""\n        },\n        {\n            ""from"": 1,\n            ""to"": 14,\n            ""label"": ""other"",\n            ""summary"": ""Constanza Martínez has commented on the implications of the Hermosilla case for public perception of justice.""\n        },\n        {\n            ""from"": 1,\n            ""to"": 15,\n            ""label"": ""other"",\n            ""summary"": ""Raúl Soto has expressed the need for transparency in the Hermosilla case and the importance of accountability.""\n        },\n        {\n            ""from"": 1,\n            ""to"": 16,\n            ""label"": ""other"",\n            ""summary"": ""Emilia Ríos has criticized Sebastián Sichel\'s connections to Luis Hermosilla in the context of the upcoming elections.""\n        },\n        {\n            ""from"": 1,\n            ""to"": 17,\n            ""label"": ""other"",\n            ""summary"": ""Sebastián Sichel has been mentioned in connection with Luis Hermosilla during the corruption investigation.""\n        }\n    ]\n}', 'refusal': None}, 'logprobs': None, 'finish_reason': 'stop'}]",42798,1749,44547,0,fp_483d39d857
batch_req_SLkvzr3CEum0rLKLaqfbqDpx,task-16,,200,eba0486e402ac06416c0c40e09e09a7f,chatcmpl-A7pCW68B6MXdbOssKwTM5U2vfqhMK,chat.completion,1726428476,gpt-4o-mini-2024-07-18,"[{'index': 0, 'message': {'role': 'assistant', 'content': '{\n    ""nodes"": [\n        {\n            ""id"": 1,\n            ""label"": ""luis hermosilla"",\n            ""summary"": ""Luis Hermosilla is a lawyer accused of corruption, including money laundering, bribery, and tax crimes in the \'Caso Audios\'.""\n        },\n        {\n            ""id"": 2,\n            ""label"": ""juan pablo hermosilla"",\n            ""summary"": ""Juan Pablo Hermosilla is the brother and defense attorney of Luis Hermosilla, who has publicly criticized the government\'s handling of the case.""\n        },\n        {\n            ""id"": 3,\n            ""label"": ""leonarda villalobos"",\n            ""summary"": ""Leonarda Villalobos is a co-defendant with Luis Hermosilla in the \'Caso Audios\', facing similar charges of corruption.""\n        },\n        {\n            ""id"": 4,\n            ""label"": ""mariana leyton"",\n            ""summary"": ""Mariana Leyton is the judge who ordered the preventive detention of Luis Hermosilla and Leonarda Villalobos.""\n        },\n        {\n            ""id"": 5,\n            ""label"": ""carolina tohá"",\n            ""summary"": ""Carolina Tohá is the Minister of the Interior who commented on the case, emphasizing the need for justice against corruption.""\n        },\n        {\n            ""id"": 6,\n            ""label"": ""ángel valencia"",\n            ""summary"": ""Ángel Valencia is the National Prosecutor who oversees the investigation into Luis Hermosilla and has stated that the investigation will proceed without bias.""\n        },\n        {\n            ""id"": 7,\n            ""label"": ""jean pierre matus"",\n            ""summary"": ""Jean Pierre Matus is a Supreme Court minister who has been linked to Luis Hermosilla through past communications regarding legal matters.""\n        },\n        {\n            ""id"": 8,\n            ""label"": ""manuel guerra"",\n            ""summary"": ""Manuel Guerra is a former prosecutor being investigated for his communications with Luis Hermosilla during the Penta case.""\n        },\n        {\n            ""id"": 9,\n            ""label"": ""daniel sauer"",\n            ""summary"": ""Daniel Sauer is implicated in the \'Caso Audios\' and is mentioned in connection with Luis Hermosilla\'s alleged corrupt activities.""\n        },\n        {\n            ""id"": 10,\n            ""label"": ""rodrigo topelberg"",\n            ""summary"": ""Rodrigo Topelberg is a key figure in the \'Caso Audios\', having leaked recordings that initiated the investigation into Luis Hermosilla.""\n        },\n        {\n            ""id"": 11,\n            ""label"": ""tonka tomicic"",\n            ""summary"": ""Tonka Tomicic is a public figure mentioned in the context of financial dealings related to Luis Hermosilla and Leonarda Villalobos.""\n        },\n        {\n            ""id"": 12,\n            ""label"": ""patricio mejías"",\n            ""summary"": ""Patricio Mejías is a public official involved in the investigation, facing charges related to bribery in the \'Caso Audios\'.""\n        },\n        {\n            ""id"": 13,\n            ""label"": ""renato robles"",\n            ""summary"": ""Renato Robles is another public official implicated in the \'Caso Audios\', facing similar charges as Patricio Mejías.""\n        }\n    ],\n    ""edges"": [\n        {\n            ""from"": 1,\n            ""to"": 3,\n            ""label"": ""defendant"",\n            ""summary"": ""Luis Hermosilla and Leonarda Villalobos are co-defendants in the same corruption case.""\n        },\n        {\n            ""from"": 1,\n            ""to"": 4,\n            ""label"": ""defendant"",\n            ""summary"": ""Luis Hermosilla was ordered to prison by Judge Mariana Leyton.""\n        },\n        {\n            ""from"": 1,\n            ""to"": 2,\n            ""label"": ""associate"",\n            ""summary"": ""Juan Pablo Hermosilla is the brother and defense attorney of Luis Hermosilla.""\n        },\n        {\n            ""from"": 2,\n            ""to"": 5,\n            ""label"": ""investigator"",\n            ""summary"": ""Juan Pablo Hermosilla criticized Minister Carolina Tohá\'s comments regarding his brother\'s case.""\n        },\n        {\n            ""from"": 1,\n            ""to"": 6,\n            ""label"": ""investigator"",\n            ""summary"": ""Luis Hermosilla is under investigation by National Prosecutor Ángel Valencia.""\n        },\n        {\n            ""from"": 1,\n            ""to"": 7,\n            ""label"": ""acquaintance"",\n            ""summary"": ""Luis Hermosilla has had past communications with Jean Pierre Matus regarding legal matters.""\n        },\n        {\n            ""from"": 1,\n            ""to"": 8,\n            ""label"": ""investigator"",\n            ""summary"": ""Luis Hermosilla\'s communications with former prosecutor Manuel Guerra are under investigation.""\n        },\n        {\n            ""from"": 1,\n            ""to"": 9,\n            ""label"": ""associate"",\n            ""summary"": ""Daniel Sauer is implicated in the same corruption case as Luis Hermosilla.""\n        },\n        {\n            ""from"": 1,\n            ""to"": 10,\n            ""label"": ""whistleblower"",\n            ""summary"": ""Rodrigo Topelberg leaked recordings that initiated the investigation into Luis Hermosilla.""\n        },\n        {\n            ""from"": 3,\n            ""to"": 11,\n            ""label"": ""associate"",\n            ""summary"": ""Tonka Tomicic is mentioned in financial dealings related to Leonarda Villalobos.""\n        },\n        {\n            ""from"": 12,\n            ""to"": 1,\n            ""label"": ""defendant"",\n            ""summary"": ""Patricio Mejías is a public official facing charges in the same case as Luis Hermosilla.""\n        },\n        {\n            ""from"": 13,\n            ""to"": 1,\n            ""label"": ""defendant"",\n            ""summary"": ""Renato Robles is also facing charges in the same corruption case as Luis Hermosilla.""\n        }\n    ]\n}', 'refusal': None}, 'logprobs': None, 'finish_reason': 'stop'}]",42746,1290,44036,0,fp_483d39d857
batch_req_sLJnQlQ3e1Wf4IAUoB36Qm40,task-17,,200,d53a5bbd72cb571623b17cdf3ef34d61,chatcmpl-A7pCWLUssGxR4YAZA0JHvOWMvBYfv,chat.completion,1726428476,gpt-4o-mini-2024-07-18,"[{'index': 0, 'message': {'role': 'assistant', 'content': '{\n    ""nodes"": [\n        {\n            ""id"": 1,\n            ""label"": ""luis hermosilla"",\n            ""summary"": ""Luis Hermosilla is a lawyer accused of bribery, money laundering, and tax crimes in the high-profile \'Caso Audios\'.""\n        },\n        {\n            ""id"": 2,\n            ""label"": ""juan pablo hermosilla"",\n            ""summary"": ""Juan Pablo Hermosilla is the brother and defense attorney of Luis Hermosilla, actively defending him in the corruption case.""\n        },\n        {\n            ""id"": 3,\n            ""label"": ""leonarda villalobos"",\n            ""summary"": ""Leonarda Villalobos is a lawyer and co-defendant with Luis Hermosilla in the \'Caso Audios\', accused of similar crimes.""\n        },\n        {\n            ""id"": 4,\n            ""label"": ""gabriel boric"",\n            ""summary"": ""Gabriel Boric is the President of Chile who commented on the case, stating that those who believed themselves powerful should face justice.""\n        },\n        {\n            ""id"": 5,\n            ""label"": ""mariana leyton"",\n            ""summary"": ""Mariana Leyton is the judge who ordered the preventive detention of Luis Hermosilla and Leonarda Villalobos.""\n        },\n        {\n            ""id"": 6,\n            ""label"": ""luis angulo"",\n            ""summary"": ""Luis Angulo is the husband of Leonarda Villalobos, who received a less severe measure of house arrest in the same case.""\n        },\n        {\n            ""id"": 7,\n            ""label"": ""rodrigo topelberg"",\n            ""summary"": ""Rodrigo Topelberg is a businessman involved in the \'Caso Audios\', currently detained in the same facility as Luis Hermosilla.""\n        },\n        {\n            ""id"": 8,\n            ""label"": ""daniel jadue"",\n            ""summary"": ""Daniel Jadue is a former mayor also implicated in corruption, currently detained in the same facility as Luis Hermosilla.""\n        },\n        {\n            ""id"": 9,\n            ""label"": ""felipe sepulveda"",\n            ""summary"": ""Felipe Sepulveda is the prosecutor involved in the \'Caso Audios\', presenting evidence against Luis Hermosilla.""\n        },\n        {\n            ""id"": 10,\n            ""label"": ""lorena parra"",\n            ""summary"": ""Lorena Parra is the prosecutor leading the investigation into the \'Caso Audios\', who previously communicated with Luis Hermosilla.""\n        },\n        {\n            ""id"": 11,\n            ""label"": ""luis cordero"",\n            ""summary"": ""Luis Cordero is the Minister of Justice who criticized Juan Pablo Hermosilla\'s comments regarding the case.""\n        },\n        {\n            ""id"": 12,\n            ""label"": ""alejandra borda"",\n            ""summary"": ""Alejandra Borda is the defense attorney for Leonarda Villalobos, who has criticized the treatment of women in the prison system.""\n        },\n        {\n            ""id"": 13,\n            ""label"": ""andres chadwick"",\n            ""summary"": ""Andres Chadwick is a former minister and associate of Luis Hermosilla, mentioned in the context of the corruption case.""\n        },\n        {\n            ""id"": 14,\n            ""label"": ""sabas chahuan"",\n            ""summary"": ""Sabas Chahuan is a former National Prosecutor who revealed that Luis Hermosilla contacted him regarding investigations involving high-profile individuals.""\n        }\n    ],\n    ""edges"": [\n        {\n            ""from"": 1,\n            ""to"": 2,\n            ""label"": ""defendant"",\n            ""summary"": ""Luis Hermosilla is represented by his brother Juan Pablo Hermosilla in the corruption case.""\n        },\n        {\n            ""from"": 1,\n            ""to"": 3,\n            ""label"": ""defendant"",\n            ""summary"": ""Luis Hermosilla and Leonarda Villalobos are co-defendants in the same corruption case.""\n        },\n        {\n            ""from"": 1,\n            ""to"": 4,\n            ""label"": ""observer"",\n            ""summary"": ""Gabriel Boric commented on Luis Hermosilla\'s case, emphasizing the need for justice.""\n        },\n        {\n            ""from"": 1,\n            ""to"": 5,\n            ""label"": ""defendant"",\n            ""summary"": ""Mariana Leyton is the judge who ordered the preventive detention of Luis Hermosilla.""\n        },\n        {\n            ""from"": 1,\n            ""to"": 6,\n            ""label"": ""associate"",\n            ""summary"": ""Luis Angulo is the husband of Leonarda Villalobos, who is also involved in the same case.""\n        },\n        {\n            ""from"": 1,\n            ""to"": 7,\n            ""label"": ""associate"",\n            ""summary"": ""Rodrigo Topelberg is detained in the same facility as Luis Hermosilla, both involved in corruption.""\n        },\n        {\n            ""from"": 1,\n            ""to"": 8,\n            ""label"": ""associate"",\n            ""summary"": ""Daniel Jadue is another high-profile individual detained in the same facility as Luis Hermosilla.""\n        },\n        {\n            ""from"": 1,\n            ""to"": 9,\n            ""label"": ""investigator"",\n            ""summary"": ""Felipe Sepulveda is the prosecutor investigating Luis Hermosilla\'s case.""\n        },\n        {\n            ""from"": 1,\n            ""to"": 10,\n            ""label"": ""informant"",\n            ""summary"": ""Lorena Parra is the prosecutor who has communicated with Luis Hermosilla regarding the case.""\n        },\n        {\n            ""from"": 2,\n            ""to"": 4,\n            ""label"": ""whistleblower"",\n            ""summary"": ""Juan Pablo Hermosilla has publicly criticized Gabriel Boric\'s comments on the case.""\n        },\n        {\n            ""from"": 2,\n            ""to"": 5,\n            ""label"": ""associate"",\n            ""summary"": ""Juan Pablo Hermosilla has had tense interactions with Judge Mariana Leyton during the hearings.""\n        },\n        {\n            ""from"": 2,\n            ""to"": 11,\n            ""label"": ""informant"",\n            ""summary"": ""Juan Pablo Hermosilla has made statements regarding the actions of Minister Luis Cordero.""\n        },\n        {\n            ""from"": 3,\n            ""to"": 10,\n            ""label"": ""associate"",\n            ""summary"": ""Leonarda Villalobos is represented by Alejandra Borda, who has criticized the treatment of women in prison.""\n        },\n        {\n            ""from"": 4,\n            ""to"": 11,\n            ""label"": ""observer"",\n            ""summary"": ""Gabriel Boric\'s comments on the case have been criticized by Juan Pablo Hermosilla.""\n        },\n        {\n            ""from"": 10,\n            ""to"": 14,\n            ""label"": ""acquaintance"",\n            ""summary"": ""Lorena Parra and Sabas Chahuan have had past interactions regarding legal matters.""\n        },\n        {\n            ""from"": 1,\n            ""to"": 12,\n            ""label"": ""associate"",\n            ""summary"": ""Alejandra Borda is the defense attorney for Leonarda Villalobos, who is co-defendant with Luis Hermosilla.""\n        },\n        {\n            ""from"": 1,\n            ""to"": 13,\n            ""label"": ""associate"",\n            ""summary"": ""Andres Chadwick is a former minister associated with Luis Hermosilla.""\n        }\n    ]\n}', 'refusal': None}, 'logprobs': None, 'finish_reason': 'stop'}]",43010,1605,44615,0,fp_483d39d857
