id,custom_id,error,response.status_code,response.request_id,response.body.id,response.body.object,response.body.created,response.body.model,response.body.choices,response.body.usage.prompt_tokens,response.body.usage.completion_tokens,response.body.usage.total_tokens,response.body.usage.completion_tokens_details.reasoning_tokens,response.body.system_fingerprint
batch_req_oTOM2kVsb5EEcwvXqBD503F2,task-5,,200,4fecffb52bbd17b2461f9a8268371a47,chatcmpl-A7pCUBezDTwiS1rs12PhrN3nhFTkE,chat.completion,1726428474,gpt-4o-mini-2024-07-18,"[{'index': 0, 'message': {'role': 'assistant', 'content': '{\n    ""nodes"": [\n        {\n            ""id"": 1,\n            ""label"": ""luis hermosilla"",\n            ""summary"": ""Luis Hermosilla is a lawyer implicated in multiple corruption cases, including bribery and money laundering.""\n        },\n        {\n            ""id"": 2,\n            ""label"": ""camila musante"",\n            ""summary"": ""Camila Musante is a deputy who has called for investigations into Luis Hermosilla\'s alleged corrupt activities.""\n        },\n        {\n            ""id"": 3,\n            ""label"": ""leonarda villalobos"",\n            ""summary"": ""Leonarda Villalobos is a lawyer and associate of Luis Hermosilla, involved in the same corruption cases.""\n        },\n        {\n            ""id"": 4,\n            ""label"": ""luis angulo"",\n            ""summary"": ""Luis Angulo is the husband of Leonarda Villalobos and is also implicated in the corruption cases.""\n        },\n        {\n            ""id"": 5,\n            ""label"": ""daniel manouchehri"",\n            ""summary"": ""Daniel Manouchehri is a deputy and complainant in the corruption cases involving Luis Hermosilla.""\n        },\n        {\n            ""id"": 6,\n            ""label"": ""patricio mejías"",\n            ""summary"": ""Patricio Mejías is a public official accused of receiving bribes from Luis Hermosilla.""\n        },\n        {\n            ""id"": 7,\n            ""label"": ""renato robles"",\n            ""summary"": ""Renato Robles is a public official from the Treasury General of the Republic involved in the corruption cases.""\n        },\n        {\n            ""id"": 8,\n            ""label"": ""ángela vivanco"",\n            ""summary"": ""Ángela Vivanco is a Supreme Court minister whose partner is implicated in the corruption cases involving Luis Hermosilla.""\n        },\n        {\n            ""id"": 9,\n            ""label"": ""carlos palma"",\n            ""summary"": ""Carlos Palma is a regional prosecutor who received offers from Gonzalo Migueles related to the nomination of the national prosecutor.""\n        },\n        {\n            ""id"": 10,\n            ""label"": ""gonzalo migueles"",\n            ""summary"": ""Gonzalo Migueles is the partner of Ángela Vivanco and is implicated in attempts to influence judicial nominations.""\n        },\n        {\n            ""id"": 11,\n            ""label"": ""luis cordero"",\n            ""summary"": ""Luis Cordero is the Minister of Justice who has commented on the need for reforms in the judicial nomination process.""\n        }\n    ],\n    ""edges"": [\n        {\n            ""from"": 1,\n            ""to"": 3,\n            ""label"": ""associate"",\n            ""summary"": ""Luis Hermosilla and Leonarda Villalobos are professional associates involved in the same corruption cases.""\n        },\n        {\n            ""from"": 1,\n            ""to"": 4,\n            ""label"": ""associate"",\n            ""summary"": ""Luis Hermosilla and Luis Angulo are connected through their involvement in the same corruption cases.""\n        },\n        {\n            ""from"": 1,\n            ""to"": 2,\n            ""label"": ""defendant"",\n            ""summary"": ""Luis Hermosilla is facing formal charges as highlighted by Camila Musante\'s calls for investigation.""\n        },\n        {\n            ""from"": 1,\n            ""to"": 5,\n            ""label"": ""defendant"",\n            ""summary"": ""Luis Hermosilla is a co-defendant in the corruption cases that Daniel Manouchehri is involved in.""\n        },\n        {\n            ""from"": 1,\n            ""to"": 6,\n            ""label"": ""beneficiary"",\n            ""summary"": ""Patricio Mejías allegedly benefited from bribes paid by Luis Hermosilla.""\n        },\n        {\n            ""from"": 1,\n            ""to"": 7,\n            ""label"": ""intermediary"",\n            ""summary"": ""Renato Robles is implicated as an intermediary in the bribery schemes involving Luis Hermosilla.""\n        },\n        {\n            ""from"": 3,\n            ""to"": 4,\n            ""label"": ""partner"",\n            ""summary"": ""Leonarda Villalobos and Luis Angulo are partners in both marriage and alleged criminal activities.""\n        },\n        {\n            ""from"": 8,\n            ""to"": 10,\n            ""label"": ""acquaintance"",\n            ""summary"": ""Ángela Vivanco and Gonzalo Migueles are partners, with Migueles involved in the judicial nomination controversy.""\n        },\n        {\n            ""from"": 9,\n            ""to"": 10,\n            ""label"": ""acquaintance"",\n            ""summary"": ""Carlos Palma received offers from Gonzalo Migueles regarding the fiscal national nomination.""\n        },\n        {\n            ""from"": 11,\n            ""to"": 1,\n            ""label"": ""investigator"",\n            ""summary"": ""Luis Cordero, as Minister of Justice, is overseeing the investigation into Luis Hermosilla\'s activities.""\n        }\n    ]\n}', 'refusal': None}, 'logprobs': None, 'finish_reason': 'stop'}]",42023,1062,43085,0,fp_483d39d857
batch_req_HekIBnGGY8CB1UrZyeVMWx8H,task-6,,200,08ebd7c9b7dd5bfb11d3116daa2157e6,chatcmpl-A7pCVCWgOtVqFdJEcuGeF2I4cBfM5,chat.completion,1726428475,gpt-4o-mini-2024-07-18,"[{'index': 0, 'message': {'role': 'assistant', 'content': '{\n    ""nodes"": [\n        {\n            ""id"": 1,\n            ""label"": ""luis hermosilla"",\n            ""summary"": ""A prominent lawyer involved in multiple corruption cases, including the \'Caso Audios\'.""\n        },\n        {\n            ""id"": 2,\n            ""label"": ""ángela vivanco"",\n            ""summary"": ""Minister of the Supreme Court implicated in corruption allegations related to her communications with Luis Hermosilla.""\n        },\n        {\n            ""id"": 3,\n            ""label"": ""gonzalo migueles"",\n            ""summary"": ""Partner of Ángela Vivanco and involved in alleged influence peddling for judicial appointments.""\n        },\n        {\n            ""id"": 4,\n            ""label"": ""carlos palma"",\n            ""summary"": ""Regional prosecutor involved in a controversial conversation with Gonzalo Migueles regarding judicial appointments.""\n        },\n        {\n            ""id"": 5,\n            ""label"": ""daniel sauer"",\n            ""summary"": ""Businessman linked to Luis Hermosilla and involved in financial irregularities and corruption.""\n        },\n        {\n            ""id"": 6,\n            ""label"": ""jean pierre matus"",\n            ""summary"": ""Current Supreme Court minister mentioned in connection with Luis Hermosilla regarding judicial appointments.""\n        },\n        {\n            ""id"": 7,\n            ""label"": ""leonarda villalobos"",\n            ""summary"": ""Lawyer associated with Luis Hermosilla, involved in the \'Caso Audios\' and alleged corruption.""\n        },\n        {\n            ""id"": 8,\n            ""label"": ""ángel valencia"",\n            ""summary"": ""National prosecutor mentioned in the context of judicial appointments and corruption investigations.""\n        },\n        {\n            ""id"": 9,\n            ""label"": ""mario desbordes"",\n            ""summary"": ""Former Defense Minister involved in conversations related to judicial appointments.""\n        },\n        {\n            ""id"": 10,\n            ""label"": ""sergio muñoz"",\n            ""summary"": ""Former director of the PDI, involved in the corruption scandal and linked to Luis Hermosilla.""\n        },\n        {\n            ""id"": 11,\n            ""label"": ""evelyn matthei"",\n            ""summary"": ""Mayor of Providencia advocating for zero tolerance on corruption amidst the \'Caso Audios\'.""\n        },\n        {\n            ""id"": 12,\n            ""label"": ""renato robles"",\n            ""summary"": ""Treasury official accused of receiving bribes related to the \'Caso Audios\'.""\n        },\n        {\n            ""id"": 13,\n            ""label"": ""patricio mejías"",\n            ""summary"": ""SII official accused of accepting bribes in exchange for confidential information.""\n        }\n    ],\n    ""edges"": [\n        {\n            ""from"": 1,\n            ""to"": 2,\n            ""label"": ""associate"",\n            ""summary"": ""Luis Hermosilla and Ángela Vivanco are associated through professional and personal connections.""\n        },\n        {\n            ""from"": 1,\n            ""to"": 3,\n            ""label"": ""partner"",\n            ""summary"": ""Luis Hermosilla and Gonzalo Migueles are partners in alleged corrupt activities.""\n        },\n        {\n            ""from"": 3,\n            ""to"": 4,\n            ""label"": ""informant"",\n            ""summary"": ""Gonzalo Migueles offered Carlos Palma a position in exchange for support in judicial appointments.""\n        },\n        {\n            ""from"": 1,\n            ""to"": 5,\n            ""label"": ""associate"",\n            ""summary"": ""Luis Hermosilla and Daniel Sauer are associated through business dealings and corruption allegations.""\n        },\n        {\n            ""from"": 1,\n            ""to"": 6,\n            ""label"": ""whistleblower"",\n            ""summary"": ""Leonarda Villalobos recorded conversations implicating Luis Hermosilla in corruption.""\n        },\n        {\n            ""from"": 1,\n            ""to"": 10,\n            ""label"": ""collaborator"",\n            ""summary"": ""Luis Hermosilla collaborated with Sergio Muñoz in various legal matters.""\n        },\n        {\n            ""from"": 2,\n            ""to"": 8,\n            ""label"": ""observer"",\n            ""summary"": ""Ángela Vivanco is under investigation by Ángel Valencia for her connections to corruption.""\n        },\n        {\n            ""from"": 2,\n            ""to"": 4,\n            ""label"": ""informant"",\n            ""summary"": ""Ángela Vivanco\'s partner, Gonzalo Migueles, communicated with Carlos Palma regarding judicial appointments.""\n        },\n        {\n            ""from"": 11,\n            ""to"": 1,\n            ""label"": ""observer"",\n            ""summary"": ""Evelyn Matthei has publicly commented on the corruption allegations involving Luis Hermosilla.""\n        },\n        {\n            ""from"": 12,\n            ""to"": 1,\n            ""label"": ""defendant"",\n            ""summary"": ""Renato Robles is implicated in the same corruption case as Luis Hermosilla.""\n        },\n        {\n            ""from"": 13,\n            ""to"": 1,\n            ""label"": ""defendant"",\n            ""summary"": ""Patricio Mejías is implicated in the same corruption case as Luis Hermosilla.""\n        }\n    ]\n}', 'refusal': None}, 'logprobs': None, 'finish_reason': 'stop'}]",42234,1109,43343,0,fp_483d39d857
batch_req_4nqPjjxXtitz7bUrmNpOGYG3,task-7,,200,70dbc6c455e536d4f28844cd005089c7,chatcmpl-A7pCV2yAsGyRVaNeqBLGHUFkDKPXa,chat.completion,1726428475,gpt-4o-mini-2024-07-18,"[{'index': 0, 'message': {'role': 'assistant', 'content': '{\n    ""nodes"": [\n        {\n            ""id"": 1,\n            ""label"": ""luis hermosilla"",\n            ""summary"": ""A prominent lawyer involved in multiple corruption cases, including the \'Caso Audios\', facing charges of bribery, money laundering, and tax crimes.""\n        },\n        {\n            ""id"": 2,\n            ""label"": ""ángela vivanco"",\n            ""summary"": ""A suspended Supreme Court judge implicated in corruption investigations related to her communications with Luis Hermosilla.""\n        },\n        {\n            ""id"": 3,\n            ""label"": ""carmen gloria wittwer"",\n            ""summary"": ""Regional prosecutor leading investigations into corruption cases involving Luis Hermosilla and others.""\n        },\n        {\n            ""id"": 4,\n            ""label"": ""jean pierre matus"",\n            ""summary"": ""Supreme Court minister facing constitutional accusations linked to the \'Caso Audios\' and his communications with Luis Hermosilla.""\n        },\n        {\n            ""id"": 5,\n            ""label"": ""andrés chadwick"",\n            ""summary"": ""Former Minister of the Interior accused of receiving significant payments from Luis Hermosilla, raising suspicions of corruption.""\n        },\n        {\n            ""id"": 6,\n            ""label"": ""leonarda villalobos"",\n            ""summary"": ""Lawyer and associate of Luis Hermosilla, accused of bribery and money laundering in the \'Caso Audios\'.""\n        },\n        {\n            ""id"": 7,\n            ""label"": ""luis angulo"",\n            ""summary"": ""Husband of Leonarda Villalobos, also implicated in the \'Caso Audios\' for money laundering and tax crimes.""\n        },\n        {\n            ""id"": 8,\n            ""label"": ""patricio mejías"",\n            ""summary"": ""Official from the SII accused of cohecho in connection with the \'Caso Audios\'.""\n        },\n        {\n            ""id"": 9,\n            ""label"": ""renato robles"",\n            ""summary"": ""Official from the Treasury General of the Republic accused of cohecho in the \'Caso Audios\'.""\n        },\n        {\n            ""id"": 10,\n            ""label"": ""antonio jalaff"",\n            ""summary"": ""Businessman linked to the \'Caso Audios\', mentioned in communications involving Luis Hermosilla.""\n        },\n        {\n            ""id"": 11,\n            ""label"": ""gonzalo migueles"",\n            ""summary"": ""Partner of Ángela Vivanco, involved in a corruption investigation related to offers made to prosecutor Carlos Palma.""\n        },\n        {\n            ""id"": 12,\n            ""label"": ""carlos palma"",\n            ""summary"": ""Regional prosecutor under investigation for potential influence peddling related to communications with Luis Hermosilla.""\n        }\n    ],\n    ""edges"": [\n        {\n            ""from"": 1,\n            ""to"": 2,\n            ""label"": ""associate"",\n            ""summary"": ""Luis Hermosilla and Ángela Vivanco are connected through their involvement in corruption investigations.""\n        },\n        {\n            ""from"": 1,\n            ""to"": 3,\n            ""label"": ""informant"",\n            ""summary"": ""Carmen Gloria Wittwer is investigating Luis Hermosilla\'s activities in corruption cases.""\n        },\n        {\n            ""from"": 1,\n            ""to"": 4,\n            ""label"": ""associate"",\n            ""summary"": ""Luis Hermosilla and Jean Pierre Matus are linked through the accusations against Matus related to the \'Caso Audios\'.""\n        },\n        {\n            ""from"": 1,\n            ""to"": 5,\n            ""label"": ""beneficiary"",\n            ""summary"": ""Andrés Chadwick received significant payments from Luis Hermosilla, raising suspicions of corruption.""\n        },\n        {\n            ""from"": 1,\n            ""to"": 6,\n            ""label"": ""partner"",\n            ""summary"": ""Luis Hermosilla and Leonarda Villalobos are partners in legal practices and are both implicated in the \'Caso Audios\'.""\n        },\n        {\n            ""from"": 1,\n            ""to"": 7,\n            ""label"": ""associate"",\n            ""summary"": ""Luis Angulo is associated with Leonarda Villalobos, both implicated in the \'Caso Audios\'.""\n        },\n        {\n            ""from"": 1,\n            ""to"": 8,\n            ""label"": ""enabler"",\n            ""summary"": ""Patricio Mejías is accused of enabling Luis Hermosilla\'s corrupt activities through his position at the SII.""\n        },\n        {\n            ""from"": 1,\n            ""to"": 9,\n            ""label"": ""enabler"",\n            ""summary"": ""Renato Robles is accused of enabling Luis Hermosilla\'s corrupt activities through his position at the Treasury.""\n        },\n        {\n            ""from"": 1,\n            ""to"": 10,\n            ""label"": ""associate"",\n            ""summary"": ""Antonio Jalaff is linked to Luis Hermosilla through business dealings mentioned in the \'Caso Audios\'.""\n        },\n        {\n            ""from"": 11,\n            ""to"": 12,\n            ""label"": ""informant"",\n            ""summary"": ""Gonzalo Migueles is involved in a corruption investigation that includes Carlos Palma.""\n        },\n        {\n            ""from"": 12,\n            ""to"": 1,\n            ""label"": ""investigator"",\n            ""summary"": ""Carlos Palma is investigating Luis Hermosilla\'s activities related to corruption.""\n        }\n    ]\n}', 'refusal': None}, 'logprobs': None, 'finish_reason': 'stop'}]",43462,1163,44625,0,fp_483d39d857
batch_req_r1Lq6l5OLmsBEU9n8mQLSPSq,task-8,,200,101f207df7bf67482982ba180fa56358,chatcmpl-A7pCVBPKTWaO7IVjrBKAvSlOMCYMT,chat.completion,1726428475,gpt-4o-mini-2024-07-18,"[{'index': 0, 'message': {'role': 'assistant', 'content': '{\n    ""nodes"": [\n        {\n            ""id"": 1,\n            ""label"": ""luis hermosilla"",\n            ""summary"": ""Luis Hermosilla is a lawyer facing charges of bribery, money laundering, and tax crimes in the \'Caso Audios\'.""\n        },\n        {\n            ""id"": 2,\n            ""label"": ""andrés chadwick"",\n            ""summary"": ""Andrés Chadwick is a former Minister of the Interior who received substantial payments from Luis Hermosilla, which he claims were for legal services.""\n        },\n        {\n            ""id"": 3,\n            ""label"": ""leonarda villalobos"",\n            ""summary"": ""Leonarda Villalobos is a lawyer and associate of Luis Hermosilla, facing similar charges in the \'Caso Audios\' for her involvement in bribery and money laundering.""\n        },\n        {\n            ""id"": 4,\n            ""label"": ""luis angulo"",\n            ""summary"": ""Luis Angulo is the husband of Leonarda Villalobos and is also facing charges related to money laundering and tax crimes.""\n        },\n        {\n            ""id"": 5,\n            ""label"": ""patricio mejías"",\n            ""summary"": ""Patricio Mejías is a former official of the SII accused of bribery in connection with the \'Caso Audios\'.""\n        },\n        {\n            ""id"": 6,\n            ""label"": ""renato robles"",\n            ""summary"": ""Renato Robles is a former official of the Treasury accused of bribery in the \'Caso Audios\'.""\n        },\n        {\n            ""id"": 7,\n            ""label"": ""daniel sauer"",\n            ""summary"": ""Daniel Sauer is a businessman linked to the \'Caso Audios\', accused of facilitating illegal financial transactions.""\n        },\n        {\n            ""id"": 8,\n            ""label"": ""jean pierre matus"",\n            ""summary"": ""Jean Pierre Matus is a Supreme Court minister who received payments from Luis Hermosilla during the defense of Andrés Chadwick.""\n        },\n        {\n            ""id"": 9,\n            ""label"": ""juan pablo hermosilla"",\n            ""summary"": ""Juan Pablo Hermosilla is the brother and lawyer of Luis Hermosilla, defending him in the ongoing legal proceedings.""\n        }\n    ],\n    ""edges"": [\n        {\n            ""from"": 1,\n            ""to"": 2,\n            ""label"": ""beneficiary"",\n            ""summary"": ""Luis Hermosilla made substantial payments to Andrés Chadwick, claiming they were for legal services rendered.""\n        },\n        {\n            ""from"": 1,\n            ""to"": 3,\n            ""label"": ""partner"",\n            ""summary"": ""Luis Hermosilla and Leonarda Villalobos are partners in legal practice and are both implicated in the same corruption case.""\n        },\n        {\n            ""from"": 3,\n            ""to"": 4,\n            ""label"": ""associate"",\n            ""summary"": ""Leonarda Villalobos is married to Luis Angulo, who is also implicated in the corruption case.""\n        },\n        {\n            ""from"": 1,\n            ""to"": 5,\n            ""label"": ""intermediary"",\n            ""summary"": ""Luis Hermosilla is accused of using Patricio Mejías to facilitate bribery related to tax matters.""\n        },\n        {\n            ""from"": 1,\n            ""to"": 6,\n            ""label"": ""intermediary"",\n            ""summary"": ""Luis Hermosilla is accused of using Renato Robles to facilitate bribery related to financial matters.""\n        },\n        {\n            ""from"": 1,\n            ""to"": 7,\n            ""label"": ""associate"",\n            ""summary"": ""Luis Hermosilla is associated with Daniel Sauer, who is implicated in the same corruption case.""\n        },\n        {\n            ""from"": 1,\n            ""to"": 8,\n            ""label"": ""acquaintance"",\n            ""summary"": ""Luis Hermosilla has a professional relationship with Jean Pierre Matus, who received payments from him.""\n        },\n        {\n            ""from"": 9,\n            ""to"": 1,\n            ""label"": ""defendant"",\n            ""summary"": ""Juan Pablo Hermosilla is defending his brother Luis Hermosilla in the ongoing legal proceedings.""\n        }\n    ]\n}', 'refusal': None}, 'logprobs': None, 'finish_reason': 'stop'}]",42675,909,43584,0,fp_483d39d857
